{
  "ticket_id": "CT-2025-004",
  "source_system": "GE-PACS",
  "category": "CT",
  "description": "CT chest study for trauma",
  "priority": 1,
  "created_at": "2025-10-10T10:00:00Z",
  "skills_required": ["Chest", "CT"],
  "sla_minutes": 30,
  "provenance": {
    "producer_id": "ct-uploader",
    "producer_version": "2.1.0"
  }
}
